{
  "schema_version": "pllm.experiment.v2",
  "id": "native-kernel-smoke",
  "profile": "operator_smoke",
  "policy": {
    "online_workers": 1,
    "preparation_online": false,
    "client_model": false,
    "he": false,
    "experimental": false,
    "require_composition_review": true
  },
  "workload": {
    "kind": "public_kernel",
    "dim": 64,
    "lanes": 18,
    "bits": 24,
    "tile": 32,
    "repetitions": 7
  },
  "implementation": {
    "native_method": "public_modular_matrix",
    "method_ids": []
  },
  "deployment": {
    "launcher": "inprocess_fixture",
    "party_manifest": null,
    "disconnect_preparation": true,
    "max_prepared_bytes": 1048576
  }
}
